{
  "task_id": "task_20260226_165618",
  "status": "pending",
  "meta": {
    "name": "PHP类型题目",
    "category": "web",
    "difficulty": "medium",
    "score": 300,
    "description": "PHP类型题目，涉及常见的Web安全漏洞，如文件上传、代码执行、SQL注入等。"
  },
  "architecture": {
    "base_image_ref": "php:8.0-apache",
    "compose_model_ref": "web_php",
    "instance_ref": "web_php_basic",
    "runtime_config": {
      "exposed_port": 18080,
      "env_vars": {}
    }
  },
  "vulnerability": {
    "flag_value": "flag{php_web_challenge_2024}",
    "check_script": "/check/script.sh"
  }
}